{
	"$schema": "../../schemas/readie.global.schema.json",
	"banner": "<p align=\"center\">\n  <a href=\"https://c15t.com?utm_source=github&utm_medium=repopage_{{packageNameEncoded}}\" target=\"_blank\" rel=\"noopener noreferrer\">\n    <picture>\n      <source media=\"(prefers-color-scheme: dark)\" srcset=\"../../docs/assets/c15t-banner-readme-dark.svg\" type=\"image/svg+xml\">\n      <img src=\"../../docs/assets/c15t-banner-readme-light.svg\" alt=\"c15t Banner\" type=\"image/svg+xml\">\n    </picture>\n  </a>\n  <br />\n  <h1 align=\"center\">{{title}}</h1>\n</p>",
	"badges": [
		{
			"label": "GitHub stars",
			"image": "https://img.shields.io/github/stars/c15t/c15t?style=flat-square",
			"link": "https://github.com/c15t/c15t"
		},
		{
			"label": "CI",
			"image": "https://img.shields.io/github/actions/workflow/status/c15t/c15t/ci.yml?style=flat-square",
			"link": "https://github.com/c15t/c15t/actions/workflows/ci.yml"
		},
		{
			"label": "License",
			"image": "https://img.shields.io/badge/license-GPL--3.0-blue.svg?style=flat-square",
			"link": "https://github.com/c15t/c15t/blob/main/LICENSE.md"
		},
		{
			"label": "Discord",
			"image": "https://img.shields.io/discord/1312171102268690493?style=flat-square",
			"link": "https://c15t.link/discord"
		},
		{
			"label": "npm version",
			"image": "https://img.shields.io/npm/v/%40c15t%2Freact?style=flat-square",
			"link": "https://www.npmjs.com/package/@c15t/react"
		},
		{
			"label": "Top Language",
			"image": "https://img.shields.io/github/languages/top/c15t/c15t?style=flat-square",
			"link": "https://github.com/c15t/c15t"
		},
		{
			"label": "Last Commit",
			"image": "https://img.shields.io/github/last-commit/c15t/c15t?style=flat-square",
			"link": "https://github.com/c15t/c15t/commits/main"
		},
		{
			"label": "Open Issues",
			"image": "https://img.shields.io/github/issues/c15t/c15t?style=flat-square",
			"link": "https://github.com/c15t/c15t/issues"
		}
	],
	"support": [
		"Join our [Discord community](https://c15t.link/discord)",
		"Open an issue on our [GitHub repository](https://github.com/c15t/c15t/issues)",
		"Visit [consent.io](https://consent.io) and use the chat widget",
		"Contact our support team via email [support@consent.io](mailto:support@consent.io)"
	],
	"contributing": [
		"We're open to all community contributions!",
		"Read our [Contribution Guidelines](https://c15t.com/docs/oss/contributing)",
		"Review our [Code of Conduct](https://c15t.com/docs/oss/code-of-conduct)",
		"Fork the repository",
		"Create a new branch for your feature",
		"Submit a pull request",
		"**All contributions, big or small, are welcome and appreciated!**"
	],
	"security": "If you believe you have found a security vulnerability in c15t, we encourage you to **_responsibly disclose this and NOT open a public issue_**. We will investigate all legitimate reports.\n\nOur preference is that you make use of GitHub's private vulnerability reporting feature to disclose potential security vulnerabilities in our Open Source Software. To do this, please visit [https://github.com/c15t/c15t/security](https://github.com/c15t/c15t/security) and click the \"Report a vulnerability\" button.\n\n### Security Policy\n\n- Please do not share security vulnerabilities in public forums, issues, or pull requests\n- Provide detailed information about the potential vulnerability\n- Allow reasonable time for us to address the issue before any public disclosure\n- We are committed to addressing security concerns promptly and transparently",
	"license": {
		"name": "GNU General Public License v3.0",
		"url": "https://github.com/c15t/c15t/blob/main/LICENSE.md"
	},
	"footer": "---\n\n**Built with ❤️ by the [consent.io](https://www.consent.io?utm_source=github&utm_medium=repopage_{{packageNameEncoded}}) team**"
}
